{
  "document_type": "infographic",
  "locale": "zh-CN",
  "meta": {
    "title": "2025 年职场工作方式变革",
    "subtitle": "数据揭示的远程与混合办公新趋势",
    "eyebrow": "Momo Paper / infographic / zh-CN"
  },
  "sections": {
    "headline": {
      "body": [
        "2025 年，全球 42% 的知识工作者已采用混合办公模式。这场变革不仅改变了工作地点，更重塑了协作方式、工具选择与企业文化的底层逻辑。"
      ]
    },
    "metrics": [
      { "label": "混合办公占比", "value": "42%", "unit": "全球知识工作者" },
      { "label": "工作效率提升", "value": "23%", "unit": "vs 纯办公室" },
      { "label": "员工留存率提升", "value": "35%", "unit": "提供混合办公的企业" },
      { "label": "通勤时间节省", "value": "52", "unit": "分钟/天/人" }
    ],
    "core_path": {
      "body": [
        "远程工作成功的三个关键支柱："
      ],
      "steps": [
        "异步沟通优先：减少实时会议，用文档和录屏传递信息",
        "结果导向管理：关注产出而非工时，建立清晰的目标体系",
        "数字化工具栈：统一协作平台，消除信息孤岛"
      ]
    },
    "distribution": {
      "chart": {
        "type": "donut",
        "title": "工作模式分布",
        "height": 320,
        "data": {
          "labels": ["纯远程", "混合办公", "纯办公室", "弹性制"],
          "values": [18, 42, 28, 12]
        }
      }
    },
    "takeaway": {
      "body": [
        "混合办公不是临时的权宜之计，而是未来工作方式的常态。企业需要主动适应这一趋势，投资协作工具、重塑管理文化，才能在人才竞争中保持优势。"
      ]
    }
  }
}
